{"api_version":"1.0","operation":"project.update","status":"success","data":{"project":{"id":"project-one","path":"/workspace/Clients/Client/Projects/Project","manifest_path":"/workspace/Clients/Client/Projects/Project/00_Admin/project-manifest.json"},"workspace_path":"/workspace","changed_fields":["audio.sample_rate","delivery.requested_deliverables"],"invalidations":["intake.validation_context","audio_prep.validation_context","delivery.readiness"],"editable":{"project_name":"Project","artist":"Artist","album":"","producer":"","mix_engineer":"Engineer","music":{"bpm":120,"key":"C","time_signature":"4/4"},"audio":{"sample_rate":96000,"bit_depth":24,"file_format":"WAV"},"delivery":{"method":"Cloud transfer","requested_deliverables":["main_mix","stems"]},"schedule":{"deadline":null},"creative_direction":""},"last_modified_at":"2030-01-01T13:00:00Z","changed":true},"warnings":[],"errors":[]}
